<?xml version="1.0" encoding="UTF-8" ?>
<rates:tariffs
        xmlns:rates="http://epam.com/rates"
        xmlns:xsi="http://www.w3.org/2001/XMLSchema-instance"
        xsi:noNamespaceSchemaLocation="schema.xsd">
    <rates:preferential-tariff name="Jukebox">
        <rates:operator-name>VELCOM</rates:operator-name>
        <rates:payroll>0</rates:payroll>
        <rates:preferential>DISABLED</rates:preferential>
    </rates:preferential-tariff>
    <rates:preferential-tariff name="Orphan happiness">
        <rates:operator-name>MTS</rates:operator-name>
        <rates:payroll>10.0</rates:payroll>
        <rates:preferential>ORPHAN</rates:preferential>
    </rates:preferential-tariff>
</rates:tariffs>